{
  "specversion": "1.0",
  "id": "10000000-0000-4000-8000-000000000002",
  "source": "/services/api",
  "type": "dev.yab1.golangtemplate.user.activated.v1",
  "subject": "urn:user:20000000-0000-4000-8000-000000000001",
  "time": "2026-09-22T08:05:00Z",
  "datacontenttype": "application/json",
  "dataschema": "/docs/eventing/schemas/user-activated.v1.schema.json",
  "correlationid": "30000000-0000-4000-8000-000000000002",
  "data": {
    "user_id": "20000000-0000-4000-8000-000000000001",
    "version": 2
  },
  "aggregateversion": 2
}
