{
  "specversion": "1.0",
  "id": "10000000-0000-4000-8000-000000000005",
  "source": "/services/api",
  "type": "dev.yab1.golangtemplate.post.created.v1",
  "subject": "urn:post:40000000-0000-4000-8000-000000000001",
  "time": "2026-09-22T09:00:00Z",
  "datacontenttype": "application/json",
  "dataschema": "/docs/eventing/schemas/post-created.v1.schema.json",
  "correlationid": "30000000-0000-4000-8000-000000000005",
  "data": {
    "post_id": "40000000-0000-4000-8000-000000000001",
    "reference_id": "GTL-PST-9KX2P",
    "owner_user_id": "20000000-0000-4000-8000-000000000001",
    "is_visible": true,
    "version": 1
  },
  "aggregateversion": 1
}
