{
  "specversion": "1.0",
  "id": "10000000-0000-4000-8000-000000000006",
  "source": "/services/api",
  "type": "dev.yab1.golangtemplate.post.updated.v1",
  "subject": "urn:post:40000000-0000-4000-8000-000000000001",
  "time": "2026-09-22T09:10:00Z",
  "datacontenttype": "application/json",
  "dataschema": "/docs/eventing/schemas/post-updated.v1.schema.json",
  "correlationid": "30000000-0000-4000-8000-000000000006",
  "data": {
    "post_id": "40000000-0000-4000-8000-000000000001",
    "changed_fields": [
      "title",
      "content"
    ],
    "version": 2
  },
  "aggregateversion": 2
}
