{
  "specversion": "1.0",
  "id": "10000000-0000-4000-8000-000000000003",
  "source": "/services/api",
  "type": "dev.yab1.golangtemplate.user.password-changed.v1",
  "subject": "urn:user:20000000-0000-4000-8000-000000000001",
  "time": "2026-09-22T08:10:00Z",
  "datacontenttype": "application/json",
  "dataschema": "/docs/eventing/schemas/user-password-changed.v1.schema.json",
  "correlationid": "30000000-0000-4000-8000-000000000003",
  "data": {
    "user_id": "20000000-0000-4000-8000-000000000001",
    "change_reason": "user_change",
    "sessions_revoked": true,
    "version": 3
  },
  "aggregateversion": 3
}
